"Dahil malalim at madilim ang lawa, hindi na niya nakita kung saan napunta ang bola at gumulong ito sa lawa.","Dahil malalim at madilim ang lawa, hindi na niya nakita kung san napunta ang bola at gumulong ito sa lawa."
Tumingin-tingin ang prinsesa sa kanyang paligid at nakita niya ang ulo ng isang palakang nakalutang sa ibabaw ng tubig.,Tumingin tingin ang prinsesa sa kanyang paligid at nakita niya ang ulo ng isang palakang nakalutang sa ibabaw ng tubig.
"Maaari kong kunin ang iyong bola para sa iyo, prinsesa","Maaari kong kunin ang iyong bola para sayo, prinsesa"
"At para sabihin sa iyo, magiging malaking proyekto ito!","At para sabihin sayo, magiging malaking proyekto ito!"
"Kaya isang araw, inimbitahan niya akong maglaro ng golf.",Kaya isang araw inimbitahan niya akong maglaro ng golf.
"Hindi nangangahulugang hindi ganoon kapalad ang lahat ng manghihinang dahil lamang sa kawalan niya ng materyal na bagay, o kung gayunman, hindi ibig sabihin na karapat dapat sa kanila iyon.","Hindi nangangahulugang hindi ganoon kapalad ang lahat ng manghihinang dahil lamang sa kawalan niya ng material na bagay, o kung gayunman, hindi ibig sabihin na karapat dapat sa kanila iyon."
"Hindi ibig sabihin na lahat, o iilan sa mga mangkukulam ay ganito, at hindi rin dahil sa pinagkakaitan ang mangkukulam na ito ng kanyang karapatan na ipahayag ang kanyang saloobin.","Hindi ibig sabihin na lahat, o iilan sa mga mangkukulam ay ganito, at hindi rin sa pinagkakaitan ang mangkukulam na ito ng kanyang karapatan na ipahayag ang kanyang saloobin."
Hindi kaduda-dudang ang kanyang ugali ay dahil sa pagpapalaki sa kanya at dahil na rin sa kinalakihan niyang lipunan na sa kasamaang palad hindi na inilahad dito upang hindi malihis ang interes ng mambabasa rito.,Hindi kaduda-dudang ang kanyang kaugalian ay dahil sa pagpapalaki sa kanya at dahil na rin sa kinalakihan niyang lipunan na sa kasamaang palad hindi na inilahad dito upang hindi malihis ang interes ng mambabasa rito.
"""Para ito sa aking asawa,"" umiyak siya sa isang paraang lalaking lalaki.","""Para ito sa aking asawa,"" umiyak siya sa isang panlalaking paraan."
"Rapunzel, Rapunzel ilagay mo ang iyong buhok upang maakyat ko ang gintong hagdan!
","Rapunzel, Rapunzel pakibaba ang iyong buhok upang maakyat ko ang gintong hagdan!
"
"Tapos, pagdating ng tamang panahon, sabihin nating isa o dalawang linggo, ipakikilala natin sa mundo ang kanyang talento at makukuha natin lahat ng pera.","Tapos, pagdating ng tamang panahon, sabihin nating isa o dalawang linggo, ilalantad natin sa mundo ang kanyang talento at makukuha natin lahat ng pera."
Hindi batayan ang kasarian sa pandadambong.,Hindi batay ang kasarian sa pandadambong.
"Marami nang nakita at napatawad ang mga matang ito, apo","Marami nang nakita at napat awad ang mga matang ito, apo"
Nagdala ako ng walang taba at walang for sodium meryenda para suportahan ang iyong matalino at wastong pagkain,Nagdala ako ng walang taba at walang sosang meryenda para suportahan ang iyong matalino at wastong pagkain
Narinig ng dumadaang taong tagasibak ng kahoy ang sigaw.,Narinig ng dumadaang taong taga-sibak ng kahoy ang sigaw.
"Sa biglang pagpasok niya sa tahanan, nakita niya ang away at sinubukan niyang itigil ito pero noong pag taas kanyang palakol, tumigil si Red Riding Hood at ang Lobo.","Sa biglang pag pasok niya sa tahanan, nakita niya ang away at sinubukan niyang itigil ito pero noong pag taas kanyang palakol, tumigil si Red Riding Hood at ang Lobo."
"Nagdesisyon sila na magtayo ng alternatibong tirahan batay sa respeto sa isa't isa at kooperasyon, at nanirahan sila sa kagubatan nang maligaya ngayon at magpakailanman.","Nag desisyon sila na magtayo ng alternatibong tirahan batay sa respeto sa isa't isa at kooperasyon, at nanirahan sila sa kagubatan nang maligaya ngayon at magpakailanman."
Tingnan mo ang natamo kong bukol nang mapatunayan mo.,Tignan mo ang natamo kong bukol nang mapatunayan mo.
"Pananakit, diskriminasyon, pananakit ng damdamin, pagsasawalang-bahala sa emosyon, panghihimasok o pang-aalipusta--sabihan mo lamang, isasampa nating lahat iyan.","Pagkasugat, diskriminasyon, pananakit ng damdamin, pagsasawalang-bahala sa emosyon, panghihimasok o pang-aalipusta--sabihan mo lamang, isasampa nating lahat iyan."
Marahil dapat maghanap tayo ng isang abogado nang malaman natin kung sino ang maaaring kasuhan.,Marahil dapat maghanap tayo ng isang abugado nang malaman natin kung sino ang maaaring kasuhan.
Gagamitin ko na ring pagkakataon iyon upang itanong sa abogado kung sino ang maaari kong kasuhan para rito sa payat at buto-buto kong mga binti.,Gagamitin ko na ring pagkakataon iyon upang itanong sa abugado kung sino ang maaari kong kasuhan para rito sa payat at buto-buto kong mga binti.
Maaari ba akong sumama para makahanap din ng maaaring kasuhan dahil sa aking payat at mababang leeg?,Maaari ba akong sumama para makahanap din ng maaaring kasuhan dahil sa aking mapayat at mababang leeg?
Ipinagpag ng tatlo ang kanilang mga pakpak dahil sa labis na kasiyahan.,Ipinayagpag ng tatlo ang kanilang mga pakpak dahil sa labis na kasiyahan.
"Marahas niyang hinaltak at hinila ang pintuan, kasabay ng pagmumura at pagsasabi nito ng masasakit na salita.","Marahas ninyang hinaltak at hinila ang pintuan, kasabay ng pagmumura at pagsasabi nito ng masasakit na salita."
Okey lang.,Ayos lang.
"Tingnan mo sila, wala sa kanilang may pera.","Tignan mo sila, wala sa kanilang may pera."
"Tingnan mo sila, wala sa kanilang may pera.","Tingnan mo sila, wala sa kaninlang may pera."
"Tingnan mo sila, wala sa kanilang may pera.","Tingnan mo sila, wala sa kanilang mayroon pera."
"Hayan, nakita ninyo?","Iyan, nakita ninyo?"
Napag-isipan mo na ba talaga ito?,Napagisipan mo na ba talaga ito?
Mukha naman silang mabait.,Para naman silang mabait.
Ngunit nandito ka na rin naman.,Ngunit nandito ka rin naman.
"Oo, para sa humigit kumulang isang daang bata.","Oo, para sa higit kumulang isang daang bata."
Magkasosyo habang-buhay.,Magka-sosyo habang-buhay.
Sila ang nagpapatakbo ng lahat ng kabulastugan dito.,Sila ang nagpapatakbo ng lahat ng kabalastugan dito.
Kailangan mong gawin yun.,Kailangan kitang gawin yun.
"Nagkamali yata kayo ng pinuntahan, pare.","Nagkamali ata kayo ng pinuntahan, pare."
"Black market exotic materials, tulad ng inakala namin.","Black market exotic materials, tulad ng inakala naming."
Uy! Si Superman ba yan?,Ah! Si Superman ba yan?
Naglakbay kayo ng napakalayo upang maging saksi sa isang napakaimportanteng bagay.,Lumakbay kayo ng napakalayo upang maging saksi sa isang napakaimportanteng bagay.
"Kapwa kong MasterBuilders, kasama na sina Robin Hood, Mermaid Lady, Gandalf, Swamp Creature, si 1980-something, Space Guy, mga NBA All-Stars ng 2002, at Wonder Woman.","Kapwa kong MasterBuilders, kabilang na sina Robin Hood, Mermaid Lady, Gandalf, Swamp Creature, si 1980-something, Space Guy, mga NBA All-Stars ng 2002, at Wonder Woman."
Kailangan niyong isulat kasi wala naman akong maaalala na kahit ano.,Kailangan niyong isulat kasi wala akong maaalala na kahit ano.
"Ang pangalan ay MetalBeard, at ikukwento ko ang aking kwento ng kabiguan.","Ang pangalan ay MetalBeard, at sasalaysayin ko ang aking kwento ng kabiguan."
"Wala akong karanasan sa pakikipaglaban, sa pamumuno, o sa paggawa ng mga plano.","Wala akong karanasan sa pakikipaglaban, sa pamumuno, o sa paggawa ng plano."
"Hindi, mayroon dapat siyang ""ngunit""","Hindi, may-roon dapat siyang ""ngunit"""
Mas mabuti pa ang pangkat na hati-hati kaysa dito.,Mas mabuti pa ang pangkat na hati-hati kaysa sa rito.
Ikaw ang pinakamasamang lider na nakita ko.,Ikaw ang pinakamasamang pinuno na nakita ko.
Hinihila mo ang katawan ko.,Hinihila mo ang aking katawan.
Natrap na natin siya.,Na-trap na natin siya.
Pag-inakyat naman ang upuan may coolers sa ilalim nito.,Pag-inakyat naman ang upuan may mga kulers sa ilalim nito.
Mukhang ako na naman ang panalo.,Mukhang ako nanaman ang panalo.
Mukhang ako na naman ang panalo.,Mukhang ako na naman panalo.
"Pero yung pagpatay sa iyo, bonus lang yun sa trabaho namin.","Pero yung pag patay sa iyo, bonus lang yun sa trabaho namin."
"Pero yung pagpatay sa iyo, bonus lang yun sa trabaho namin.","Pero yung pagpatay sayo, bonus lang yun sa trabaho namin."
"Pero yung pagpatay sa iyo, bonus lang yun sa trabaho namin.","Pero yung pagpatay sa iyo, bonus lang yun ng trabaho namin."
Pera lang naman ang ang dahilan nila eh.,Pera lang naman ang kinauudyokan nila eh.
Mga bombang idinikit ko sa mga sinturon niyo nung pumasok ako.,Mga bombang dinikit ko sa mga sinturon niyo nung pumasok ako.
Hindi mo kailang pumatay ng libo-libo  para pabagsakin ako.,Hindi mo kailang pumatay ng libo-libo  para pabagsakin ako
Kung ito lang ang magpapabagsak sa,Kung ito lang magpapabagsak sa
Balewala ang mga buhay niyo.,Bali-wala mga buhay niyo.
Tingnan mo ang nangyari sa iyo ngayon.,Tignan mo ang nangyari sa iyo ngayon.
Tingnan mo ang nangyari sa iyo ngayon.,Tingnan mo nangyari sa iyo ngayon.
Tingnan mo ang nangyari sa iyo ngayon.,Tingnan mo ang nangyari sayo ngayon.
"Kung ako sa 'yo, itago mo na yan. ","Kung ako sayo, itago mo na yan."
Hindi ka makakaalis diyan.,Hindi ka makaka-alis diyan.
Meron akong isang milyong microbes na kumakain ng wiring ng bomba.,Meron akong isang milyon na microbes na kumakain ng wiring ng bomba.
Mission sa Mars!,Mission to Mars!
Tingnan mong lahat ng damit mo!!,Tignan mong lahat ng damit mo!!
Tingnan mong lahat ng damit mo!!,Tingnan mo lahat ng damit mo!!
Tingnan mo to!,Tignan mo to!
Wala naman nagbibigay-halaga ng mga damit na ito dito eh.,Wala naman nagbibigay halaga ng mga damit na ito dito eh.
Tingnan natin...,Tignan natin...
Anong ginagawa ni Lotso kay Buzz at paano siya ibalik sa dati?,Anong ginagawa ni Lotso kay Buzz at pano siya ibalik sa dati?
Walang mag-aaway!,Walang magaaway!
Kaya konti na lang kayo sa mundo!,Kaya konti nalang kayo sa mundo!
"Anong tinitingnan mo, Feathers?","Anong tinitignan mo, Feathers?"
Bakit ang tagal-tagal nila?,Bakit ang tagal tagal nila?
Nasaan yung manwal?,Nasaan yung manual?
Nagreklamo sa pulisya ang may-ari ng bahay-panuluyan na agad namang na humuli sa sastre at dinala ito sa harap ng emperador.,Nagreklamo sa pulisya ang may-ari ng bahay panuluyan na agad namang na humuli sa sastre at dinala ito sa harap ng emperador.
Nagreklamo sa pulisya ang may-ari ng bahay-panuluyan na agad namang na humuli sa sastre at dinala ito sa harap ng emperador.,Nagreklamo sa pulisya ang may-ari ng bahay-panuluyan na agad namang agad na humuli sa sastre at dinala ito sa harap ng emperador.
Agad itong napansin ng sastre kung kayat ginamit niya ito upang makatakas sa kaniyang kinalalagyan.,Agad itong napansin ng sastre at ginamit niya ito upang makatakas sa kaniyang kinalalagyan.
Naghiyawan ang madla; at lahat ay nagtanggal ng kani-kanilang mga kasuotan at sumayaw sa initan alinsunod sa kalikasan.,Naghiyawan ang madla at lahat ay nagtanggal ng kani-kanilang mga kasuotan at sumayaw sa initan alinsunod sa kalikasan.
Naghiyawan ang madla; at lahat ay nagtanggal ng kani-kanilang mga kasuotan at sumayaw sa initan alinsunod sa kalikasan.,Naghiyawan ang madla; at lahat ay nagtanggal ng kani kanilang mga kasuotan at sumayaw sa initan alinsunod sa kalikasan.
"Kaibigan ng lahat ang isang explorer, kahit halaman, isda o langgam.","Kaibigan ng lahat ang isang explorer, kahit halaman, isda o maliit na mowl."
Posible ito sapagkat matalino ang master ko.,Posible ito sapagkat matalino ang amo ko.
"Sabi ng lalaking yan akin na raw ang ibon, at mahal ko yang lalaking yan parang master.","Sabi ng lalaking yan akin na raw ang ibon, at mahal ko yang lalaking yan parang amo."
Maaari kong tanungin sa totoong pagkatao ko kung ano ang gusto noya,Maaari kong itanong sa totoong pagkatao ko kung ano ang gusto noya
Nagniningning sa sigla at liwanag ang aking kaluluwa.,Nagniningning ng sigla at liwanag ang aking kaluluwa.
"""Baka masaktan ka lang. Maaari kang tanggihan ng mga tao"" kaya hindi ko na sinubukang gawin tio.","""Baka masaktan ka lang. Maaari kang tanggihan ng mga tao"" kaya hindi ko na sinubukan gawin tio."
Ako ang mag-uumpisa ngayon.,Ako ang maguumpisa ngayon.
"Hindi ko maibibintang sa aking mga magulang na dahil sa kanilang mga pagkukulang at problema, pero masasabi ko na ang kakulangan nila sa pag-gabay sa akin ay isang anyo ng kawalang ng hustisya.","Hindi ko mabibintang sa aking mga magulang na dahil sa kanilang mga pagkukulang at problema, pero masasabi ko na ang kakulangan nila sa pag-gabay sa akin ay isang anyo ng kawalang ng hustisya."
"Hindi ko maibibintang sa aking mga magulang na dahil sa kanilang mga pagkukulang at problema, pero masasabi ko na ang kakulangan nila sa pag-gabay sa akin ay isang anyo ng kawalang ng hustisya.","Hindi ko maibibintang ang aking mga magulang na dahil sa kanilang mga pagkukulang at problema, pero masasabi ko na ang kakulangan nila sa pag-gabay sa akin ay isang anyo ng kawalang ng hustisya."
"Hindi ko maibibintang sa aking mga magulang na dahil sa kanilang mga pagkukulang at problema, pero masasabi ko na ang kakulangan nila sa pag-gabay sa akin ay isang anyo ng kawalang ng hustisya.","Hindi ko maibibintang sa aking mga magulang dahil sa kanilang mga pagkukulang at problema, pero masasabi ko na ang kakulangan nila sa pag-gabay sa akin ay isang anyo ng kawalang ng hustisya."
"Nanggagaling ang alintuntunin ng moralidad ko sa kaisipang pansarili, hindi sa kaisipan na dahil tungkulin ko ito.","Nanggagaling ang alintuntunin ng moralidad ko sa kaisipang pansarili, hindi sa kaisipan ng tungkulin ko ito."
"Palagi kong sineseryoso ang buhay, wala ako masyadong kasiyahan nung bata pa ako, komportable na ako sa pagdurusa na minsan gumagawa ako ng problema kahit wala naman talaga.","Palagi kong sineseryoso ang buhay, wala ako masyadong kasiyahan nung bata pa ako, komportable na ako sa pag durusa na minsan gumagawa ako ng problema kahit wala naman talaga."
"Nakikita ko ang aking kinabukasan sa bagong paningin; ang pag-unawa ko kung gusto kong maging masaya o hindi, ang ibig sabihin nito.","Nakikita ko ang aking kinabukasan sa bagong paningin; ang pag-unawa ko kung gusto ko maging masaya o hindi, ang ibig sabihin nito."
"Noong bata ako, kinailangan kong malaman kung paanong patunayan ang pagtingin sa anong totoo.","Noong bata ako, kailangan kong malaman kung paanong patunayan ang pagtingin sa anong totoo."
"Noong nalasing si papa dahil sa alkohol, kinuha ko ang aking kaleidoscope at nakita ko ay nakatulog lang siya.","Nung nalasing si papa dahil sa alkohol, kinuha ko ang aking kaleidoscope at nakita ko ay nakatulog lang siya."
"Ngayong araw, itatago ko ang aking kaleidoscope.","Ngayong araw, tinago ko ang aking kaleidoscope."
"Naalala ko ang dati kong mga relasyon bilang matanda na ako, at hindi sa mga mata na matatakot na bata.",Naalala ko ang dati kong mga relasyon bilang adult at hindi sa mga mata na matatakot na bata.
Mahaba ang pinagdaanan ko papunta sa aking pagbibinata.,Mahaba ang pinagdaanan ko papunta sa akin pagbibinata.
Ang mga taon na iyon aking sinusumpa.,Ang mga taon na iyon akin sinusumpa.
Ang mga taon na iyon aking sinusumpa.,Ang mga taon na iyon ay aking sinusumpa.
Naglalaro ng kunwaring laro at sumusubok ng bagong aral ang malulusog na bata.,Ang malulusog na bata ay naglalaro ng make-believe games at sumusubok ng bagong asal.
"Ngayon, bibigyan ko ng pahintulot ang aking totoong pagkatao upang masabi niya ang kanyang kuwento.","Ngayon, bibigyan ko ng pahintulot ang aking kabataan upang masabi niya ang kanyang kuwento."
Hindi na niya kailangang maglihim ng mga detalye.,Hindi niya kailangang maglihim ng mga detalye.
Hindi na niya kailangang maglihim ng mga detalye.,Hindi na niya kailangang magtago ng mga detalye.
"Kapag hindi ko naman kilala ang aking mga kasama, aalagaan ko ang aking sarili at magsasabi lamang ng mga bagay-bagay na dapat maipahayag.","Tuwing hindi ko naman kilala ang aking mga kasama, aalagaan ko ang aking sarili at magsasabi lamang ng mga bagay-bagay na dapat maipahayag."
"Ngayong gabi, kailangang kailangan kong magpahinga, limutin ang mga gumugulo sa aking isipan at alisin ang bumubuhol sa kalamnan.","Ngayong gabi, kaylangang kailangan kong magpahinga, limutin ang mga gumugulo sa aking isipan at alisin ang bumubuhol sa kalamnan."
"Ngayong gabi, kailangang kailangan kong magpahinga, limutin ang mga gumugulo sa aking isipan at alisin ang bumubuhol sa kalamnan.","Ngayong gabi, kailangang kaylangan kong magpahinga, limutin ang mga gumugulo sa aking isipan at alisin ang bumubuhol sa kalamnan."
"Ngayong gabi, kailangang kailangan kong magpahinga, limutin ang mga gumugulo sa aking isipan at alisin ang bumubuhol sa kalamnan.","Ngayong gabi, kailangang kailangan ko magpahinga, limutin ang mga gumugulo sa aking isipan at alisin ang bumubuhol sa kalamnan."
"Ngayong gabi, kailangang kailangan kong magpahinga, limutin ang mga gumugulo sa aking isipan at alisin ang bumubuhol sa kalamnan.","Ngayong gabi, kailangan na kailangan kong magpahinga, limutin ang mga gumugulo sa aking isipan at alisin ang bumubuhol sa kalamnan."
"At ngayon sa aking isipan, isang nag-iinit na liwanag, napapalibutan ng pagmamahal at kaligtasan, ang bumabalot sa aming dalawa.","At ngayon sa aking isipan, isang nagiinit na liwanag, napapalibutan ng pagmamahal at kaligtasan, ang bumabalot sa aming dalawa."
"Kung minsan, kailangan mong malaman kung pano magpaalam sa kaibigan na iba ang pinagdadaanan niya kaysa sa iyo.","Paminsan, kailangan mong malaman kung pano magpaalam sa kaibigan na iba ang pinagdadaanan niya kaysa sa iyo."
"Kung minsan, kailangan mong malaman kung pano magpaalam sa kaibigan na iba ang pinagdadaanan niya kaysa sa iyo.","Kung minsan, kailangan mong malaman kung pano magpaalam sa kaibigan na iba ang pinagdadaanan niya kaysa sayo."
"Kapag hindi na kayo nagkikita at nag-uusap, kailangan mo na siyang iwanan.","Pag hindi na kayo nagkikita at nag-uusap, kailangan mo na siyang iwanan."
"Kapag hindi na kayo nagkikita at nag-uusap, kailangan mo na siyang iwanan.","Kapag hindi na kayo nagkikita at naguusap, kailangan mo na siyang iwanan."
Nalulungkot ako na magpaalam pero masaya ako dahil gagawin na namin ang gusto namin.,Nalulungkot ako sa magpaalam pero masaya ako dahil gagawin na namin ang gusto namin.
Natututo akong magpaalam.,Natututo ako magpaalam.
"Bilang isang binatilyo, natuto ako na isang simbolo ng pagbibilang ang maong.","Bilang isang binatilyo, natuto ko na isang simbolo ng pagbibilang ang maong."
"Noong paglaki ko, nagpatuloy pa rin akong magsuot ng maong araw-araw.","Noong paglaki ko, nagpatuloy pa rin akong sumuot ng maong araw-araw."
Nakasuot ako ng damit na angkop sa sitwasyon - nakasuot ako ng pampropesyonal sa opisina at nakasuot naman ako ng pamporma sa parti.,Sumusuot ako ng damit na angkop sa sitwasyon - nakasuot ako ng pampropesyonal sa opisina at nakasuot naman ako ng pamporma sa parti.
"Ngunit, nakasuot pa rin ako ng maong kapag gusto ko.","Ngunit, sumusuot pa rin ako ng maong kapag gusto ko."
Pwede akong manamit tulad ng isang indibidwal na may sapat na gulang habang pinamanatili pa rin ang aking sarili.,Pwede akong manamit tulad ng isang indibidwal na may sapat na gulang at pinamanatili pa rin ang aking sarili.
"Malinaw na dapat kong suriin ang aking hangarin, upang mabigyang-pansin ang aking mga ginagawa.","Malinaw na dapat kong suriin ang aking hangarin, upang mabigyang pansin ang aking mga ginagawa."
Tulad ng bato na inilaglag sa sapa na nagbigay ng konsentikong alon na lumago ng palaki nang palaki hangang mapuno ang buong sapa.,Tulad ng bato na inilaglag sa sapa na nagbigay ng konsentikong alon na lumago ng palaki ng palaki hangang mapuno ang buong sapa.
"Kinikilala ko ang mga positibong anyo, pagbabago, at ang paghabol natin sa pag-intindi buhay.","Kinikilala ko ang mga positibong anyo, pagbabago, at ang pag habol natin sa pag-intindi buhay."
"Kinikilala ko ang mga positibong anyo, pagbabago, at ang paghabol natin sa pag-intindi buhay.","Kinikilala ko ang mga positibong anyo, pagbabago, at ang paghabol natin sa pag intindi buhay."
Hinahayaan ko ang aking sariling matulog ayon sa aking pangangailangan.,Hinahayaan ko ang aking sarili matulog ayon sa aking pangangailangan.
Hinahayaan ko ang aking sariling matulog ayon sa aking pangangailangan.,Hinahayaan ko ang aking sariling matulog sa aking pangangailangan.
Hinahayaan ko ang aking sariling matulog ayon sa aking pangangailangan.,Hinahayaan ko ang aking sariling matulog ayon sa aking pangangailangan
"Minsan, ramdam ko na kinakailangan kong matulog nang isang linggo upang humabol, ngunit marami ang kinakailangang tapusin.","Minsan ramdam ko na kinakailangan kong matulog nang isang linggo upang humabol, ngunit marami ang kinakailangang tapusin."
"Minsan, ramdam ko na kinakailangan kong matulog nang isang linggo upang humabol, ngunit marami ang kinakailangang tapusin.","Minsan, ramdam ko na kinakailangan ko matulog nang isang linggo upang humabol, ngunit marami ang kinakailangang tapusin."
"Minsan, ramdam ko na kinakailangan kong matulog nang isang linggo upang humabol, ngunit marami ang kinakailangang tapusin.","Minsan, ramdam ko na kinakailangan kong matulog ng isang linggo upang humabol, ngunit marami ang kinakailangang tapusin."
"Sa gayon, umiinom ako ng kape upang manatiling gising para magpatuloy.",Sa gayon umiinom ako ng kape upang manatiling gising para magpatuloy.
"Sa gayon, umiinom ako ng kape upang manatiling gising para magpatuloy.","Sa gayon, umiinom ako ng kape upang manatiling gising at magpatuloy."
"Sa gayon, sinisigurado ko na nasa kama siya sa tamang oras at ang kanyang kama ay lugar na makakapagbigay ginhawa at panibago.","Sa gayon, sinisigurado ko na nasa kama siya ng tamang oras at ang kanyang kama ay lugar na makakapagbigay ginhawa at panibago."
Magpapatunay ako ngayon nang aking karunungang lumangoy sa mga tubig ng buhay.,Magpapatunay ako ngayon ang aking karunungang lumangoy sa mga tubig ng buhay.
Magpapatunay ako ngayon nang aking karunungang lumangoy sa mga tubig ng buhay.,Magpapatunay ako ngayon nang aking karunungan na lumangoy sa mga tubig ng buhay.
Magpapatunay ako ngayon nang aking karunungang lumangoy sa mga tubig ng buhay.,Magpapatunay ako ngayon nang aking karunungang mag langoy sa mga tubig ng buhay.
"Minsan, nararamdaman ko na parang nasa baha ako ng mga damdamin, mga takot, mga posibilidad.","Minsan nararamdaman ko na parang nasa baha ako ng mga damdamin, mga takot, mga posibilidad."
"Minsan, nararamdaman ko na parang nasa baha ako ng mga damdamin, mga takot, mga posibilidad.","Minsan, niraramdaman ko na parang nasa baha ako ng mga damdamin, mga takot, mga posibilidad."
Pakiramdam ko na parang aanurin ako ng dumaraasang taog ng buhay.,Niraramdam ko na parang aanurin ako ng dumaraasang taog ng buhay.
Pakiramdam ko na parang aanurin ako ng dumaraasang taog ng buhay.,Pakiramdam ko na parang alisin ako ng dumaraasang taog ng buhay.
"Nagugulat at natatakot ako sa laki ng mga alon na sumusugod sa akin katulad ng isang bata na nasa isang baybay-dagat sa unang pagkakataon niya, kung tumatayo ako dito at pinayagan ko ang aking sarili na malilipos ng buhay, malulunod ako .","Nagugulat at natatakot ako sa kalakihan ng mga alon na sumusugod sa akin katulad ng isang bata na nasa isang baybay-dagat sa unang pagkakataon niya, kung tumatayo ako dito at pinayagan ko ang aking sarili na malilipos ng buhay, malulunod ako ."
"Nagugulat at natatakot ako sa laki ng mga alon na sumusugod sa akin katulad ng isang bata na nasa isang baybay-dagat sa unang pagkakataon niya, kung tumatayo ako dito at pinayagan ko ang aking sarili na malilipos ng buhay, malulunod ako .","Nagugulat at natatakot ako sa laki ng alon na sumusugod sa akin katulad ng isang bata na nasa isang baybay-dagat sa unang pagkakataon niya, kung tumatayo ako dito at pinayagan ko ang aking sarili na malilipos ng buhay, malulunod ako ."
"Nagugulat at natatakot ako sa laki ng mga alon na sumusugod sa akin katulad ng isang bata na nasa isang baybay-dagat sa unang pagkakataon niya, kung tumatayo ako dito at pinayagan ko ang aking sarili na malilipos ng buhay, malulunod ako .","Nagugulat at natatakot ako sa laki ng mga alon na sumusugod sa akin katulad ng isang bata nasa isang baybay-dagat sa unang pagkakataon niya, kung tumatayo ako dito at pinayagan ko ang aking sarili na malilipos ng buhay, malulunod ako ."
"Hindi ito ang aking unang araw sa baybay-dagat, subalit kaya kong lumangoy.","Hindi ito ang aking unang araw sa baybay-dagat, at kaya kong lumangoy."
"Hindi ito ang aking unang araw sa baybay-dagat, subalit kaya kong lumangoy.","Hindi ito ang aking unang araw sa baybay-dagat, subalit kaya ko lumangoy."
"Hindi ito ang aking unang araw sa baybay-dagat, subalit kaya kong lumangoy.","Hindi ito ang aking unang araw sa baybay-dagat, subalit kaya kong maglangoy."
"Hindi ito ang aking unang araw sa baybay-dagat, subalit kaya kong lumangoy.","Ngunit hindi ang aking unang araw sa baybay-dagat, subalit kaya kong lumangoy."
Pinapayagan ko ang aking sarili na dalhin ako ng mga alon na nasa piniling kong daan.,Pinayagan ko ang aking sarili na dalhin ako ng mga alon na nasa piniling kong daan.
Pinapayagan ko ang aking sarili na dalhin ako ng mga alon na nasa piniling kong daan.,Pinapayagan ang aking sarili na dalhin ako ng mga alon na nasa piniling kong daan.
Pinapayagan ko ang aking sarili na dalhin ako ng mga alon na nasa piniling kong daan.,Pinapayagan ko ang aking sarili na magbihat sa akin ng mga alon na nasa piniling kong daan.
Ang sarili kong isip at damdamin pag-aari ko.,Ang aking isip at damdamin pag-aari ko.
"Hindi ko kailangan tingnan ang isip at damdamin ng iba, upang malaman ko kung ano ang dapat idamdam at isipin ko.","Hindi ko kailangan tingnan ang isip at damdamin ng iba, upang malaman ko kung ano dapat idamdam at isipin ko."
"Bilang isang bata, palagi ako pinagsasabihan na mali ang nararamdaman sa bawat sitwasyon.","Bilang isang bata, palagi ako pinagsasabihan na mali ang aking nararamdaman sa bawat sitwasyon."
